{
  "name": "Max",
  "author": { "name": "Gaëtan H", "github": "steellgold" },
  "url": ["max.com", "www.max.com", "play.max.com"],
  "regExp": "^https?://(www\\.|play\\.)?max\\.com/",
  "color": "#002BE7",
  "category": "streaming",
  "description": {
    "en-US": "Show what you're watching on Max.",
    "fr-FR": "Affichez ce que vous regardez sur Max.",
    "es-ES": "Muestra lo que estás viendo en Max."
  },
  "longDescription": {
    "en-US": "Max streams series, movies, and originals. This presence shows the title you're watching, with playback state when available.",
    "fr-FR": "Max diffuse des séries, films et productions originales. Cette présence affiche le titre que vous regardez, avec l'état de lecture lorsqu'il est disponible.",
    "es-ES": "Max emite series, películas y originales. Esta presencia muestra el título que estás viendo, con el estado de reproducción cuando esté disponible."
  },
  "features": {
    "en-US": [
      "Detects the current title",
      "Tracks playing and paused state",
      "Optional privacy mode",
      "Optional browsing activity"
    ],
    "fr-FR": [
      "Détecte le titre en cours",
      "Suit la lecture et la pause",
      "Mode privé optionnel",
      "Activité de navigation optionnelle"
    ],
    "es-ES": [
      "Detecta el título actual",
      "Sigue reproducción y pausa",
      "Modo privado opcional",
      "Actividad de navegación opcional"
    ]
  }
}
