{
  "name": "GitHub",
  "author": {
    "name": "Gaëtan H",
    "github": "steellgold"
  },
  "url": ["github.com", "gist.github.com", "github.blog", "githubnext.com", "githubuniverse.com"],
  "regExp": "^https?://(github\\.com|gist\\.github\\.com|github\\.blog|githubnext\\.com|githubuniverse\\.com)/",
  "color": "#0FBF3E",
  "category": "tools",
  "description": {
    "en-US": "Show where you're browsing on GitHub — repos, PRs, issues, and more.",
    "fr-FR": "Affichez où vous naviguez sur GitHub — dépôts, pull requests, issues et plus.",
    "es-ES": "Muestra por dónde navegas en GitHub: repos, PRs, issues y más."
  },
  "longDescription": {
    "en-US": "GitHub hosts repositories, pull requests, issues, gists, and product updates. This presence shows where you are across GitHub, Gist, GitHub Blog, GitHub Next, and GitHub Universe. Private repositories stay hidden unless you opt in.",
    "fr-FR": "GitHub héberge dépôts, pull requests, issues, gists et actualités produit. Cette présence affiche où vous êtes sur GitHub, Gist, GitHub Blog, GitHub Next et GitHub Universe. Les dépôts privés restent masqués, sauf si vous l'activez.",
    "es-ES": "GitHub aloja repositorios, pull requests, issues, gists y novedades de producto. Esta presencia muestra dónde estás en GitHub, Gist, GitHub Blog, GitHub Next y GitHub Universe. Los repositorios privados permanecen ocultos salvo que lo actives."
  },
  "features": {
    "en-US": [
      "Detects repositories and profiles",
      "Optional private-repository visibility",
      "GitHub Copilot and Spark pages",
      "Marketplace, MCP Registry, topics, trending, and collections",
      "Issues, notifications, pull requests, and feed",
      "Optional Gist, GitHub Blog, and GitHub Next",
      "GitHub Universe event pages"
    ],
    "fr-FR": [
      "Détecte les dépôts et les profils",
      "Visibilité optionnelle des dépôts privés",
      "Pages GitHub Copilot et Spark",
      "Marketplace, registre MCP, sujets, tendances et collections",
      "Issues, notifications, pull requests et fil",
      "Gist, GitHub Blog et GitHub Next en option",
      "Pages de l'événement GitHub Universe"
    ],
    "es-ES": [
      "Detecta repositorios y perfiles",
      "Visibilidad opcional de repositorios privados",
      "Páginas de GitHub Copilot y Spark",
      "Marketplace, registro MCP, temas, tendencias y colecciones",
      "Issues, notificaciones, pull requests y feed",
      "Gist, GitHub Blog y GitHub Next opcionales",
      "Páginas del evento GitHub Universe"
    ]
  }
}
